{"$schema":"https://json-schema.org/draft/2020-12/schema","$id":"https://schemas.orchestra.dev/machine/ui-design-contract/1.0.0","title":"Orchestra UI Design Contract","description":"Library-neutral, evidence-bound design intent contract for governed UI implementation and fidelity validation.","type":"object","additionalProperties":false,"required":["schema_version","contract_id","source","design_system","components","layouts","theme","assets","accessibility","fidelity","validation","authority"],"properties":{"schema_version":{"const":"orchestra.ui-design-contract.v1"},"contract_id":{"type":"string","minLength":1},"source":{"$ref":"#/$defs/source"},"design_system":{"$ref":"#/$defs/designSystem"},"components":{"type":"array","items":{"$ref":"#/$defs/component"}},"layouts":{"type":"array","items":{"$ref":"#/$defs/layout"}},"theme":{"$ref":"#/$defs/theme"},"assets":{"type":"array","items":{"$ref":"#/$defs/asset"}},"accessibility":{"$ref":"#/$defs/accessibilityContract"},"fidelity":{"$ref":"#/$defs/fidelity"},"validation":{"$ref":"#/$defs/validation"},"authority":{"$ref":"#/$defs/authority"}},"$defs":{"confidence":{"enum":["CONFIRMED","MISSING","INFERRED_WITH_EXPLICIT_APPROVAL","UNRESOLVED"]},"evidenceRef":{"type":"object","additionalProperties":false,"required":["value","confidence","source_ref"],"properties":{"value":{"type":"string","minLength":1},"confidence":{"$ref":"#/$defs/confidence"},"source_ref":{"type":"string","minLength":1},"approval_ref":{"type":"string","minLength":1}},"allOf":[{"if":{"properties":{"confidence":{"const":"INFERRED_WITH_EXPLICIT_APPROVAL"}},"required":["confidence"]},"then":{"required":["approval_ref"]}}]},"source":{"type":"object","additionalProperties":false,"required":["provider","artifact_identity","reference_identity","evidence_confidence","evidence_refs","capabilities"],"properties":{"provider":{"enum":["FIGMA","PROJECT_NATIVE","STORYBOOK","SCREENSHOT","REFERENCE_IMAGE","OTHER_STRUCTURED","NONE"]},"artifact_identity":{"type":"string","minLength":1},"reference_identity":{"type":"string","minLength":1},"node_or_component_identity":{"type":["string","null"],"minLength":1},"reference_revision_or_timestamp":{"type":["string","null"],"minLength":1},"evidence_confidence":{"$ref":"#/$defs/confidence"},"approval_ref":{"type":"string","minLength":1},"evidence_refs":{"type":"array","items":{"type":"string","minLength":1},"uniqueItems":true},"capabilities":{"type":"array","items":{"enum":["STRUCTURED_CONTEXT","CODE_CONNECT","COMPONENT_DOCS","DESIGN_TOKENS","EXACT_ASSETS","RENDERED_REFERENCE"]},"uniqueItems":true}},"allOf":[{"if":{"properties":{"evidence_confidence":{"const":"INFERRED_WITH_EXPLICIT_APPROVAL"}},"required":["evidence_confidence"]},"then":{"required":["approval_ref"]}}]},"token":{"type":"object","additionalProperties":false,"required":["name","value","source_ref","evidence_confidence"],"properties":{"name":{"type":"string","minLength":1},"value":{"type":["string","number","boolean"]},"source_ref":{"type":"string","minLength":1},"evidence_confidence":{"$ref":"#/$defs/confidence"},"approval_ref":{"type":"string","minLength":1}},"allOf":[{"if":{"properties":{"evidence_confidence":{"const":"INFERRED_WITH_EXPLICIT_APPROVAL"}},"required":["evidence_confidence"]},"then":{"required":["approval_ref"]}}]},"designSystem":{"type":"object","additionalProperties":false,"required":["primitive_tokens","semantic_tokens","component_tokens","typography_roles","spacing_scale","radii","borders","shadows","motion","breakpoints"],"properties":{"primitive_tokens":{"type":"array","items":{"$ref":"#/$defs/token"}},"semantic_tokens":{"type":"array","items":{"$ref":"#/$defs/token"}},"component_tokens":{"type":"array","items":{"$ref":"#/$defs/token"}},"typography_roles":{"type":"array","items":{"$ref":"#/$defs/token"}},"spacing_scale":{"type":"array","items":{"$ref":"#/$defs/token"}},"radii":{"type":"array","items":{"$ref":"#/$defs/token"}},"borders":{"type":"array","items":{"$ref":"#/$defs/token"}},"shadows":{"type":"array","items":{"$ref":"#/$defs/token"}},"motion":{"type":"array","items":{"$ref":"#/$defs/token"}},"breakpoints":{"type":"array","items":{"$ref":"#/$defs/token"}}}},"accessibilityContract":{"type":"object","additionalProperties":false,"required":["semantics","keyboard","focus","names_descriptions","contrast","target_size","reduced_motion","error_state"],"properties":{"semantics":{"type":"array","items":{"type":"string","minLength":1},"uniqueItems":true},"keyboard":{"type":"array","items":{"type":"string","minLength":1},"uniqueItems":true},"focus":{"type":"array","items":{"type":"string","minLength":1},"uniqueItems":true},"names_descriptions":{"type":"array","items":{"type":"string","minLength":1},"uniqueItems":true},"contrast":{"type":"array","items":{"type":"string","minLength":1},"uniqueItems":true},"target_size":{"type":"array","items":{"type":"string","minLength":1},"uniqueItems":true},"reduced_motion":{"type":"array","items":{"type":"string","minLength":1},"uniqueItems":true},"error_state":{"type":"array","items":{"type":"string","minLength":1},"uniqueItems":true}}},"projectMapping":{"type":"object","additionalProperties":false,"required":["mapping_kind","source_ref"],"properties":{"mapping_kind":{"enum":["EXACT","ADAPTED","NONE","UNRESOLVED"]},"target":{"type":"string","minLength":1},"source_ref":{"type":"string","minLength":1}},"allOf":[{"if":{"properties":{"mapping_kind":{"enum":["EXACT","ADAPTED"]}},"required":["mapping_kind"]},"then":{"required":["target"]}}]},"component":{"type":"object","additionalProperties":false,"required":["component_id","source_mapping","variants","states","slots","accessibility_contract","project_component_mapping"],"properties":{"component_id":{"type":"string","minLength":1},"source_mapping":{"$ref":"#/$defs/evidenceRef"},"variants":{"type":"array","items":{"type":"string","minLength":1},"uniqueItems":true},"states":{"type":"array","items":{"type":"string","minLength":1},"uniqueItems":true},"slots":{"type":"array","items":{"type":"string","minLength":1},"uniqueItems":true},"accessibility_contract":{"$ref":"#/$defs/accessibilityContract"},"project_component_mapping":{"$ref":"#/$defs/projectMapping"}}},"layout":{"type":"object","additionalProperties":false,"required":["layout_id","pattern","regions","responsive_order","containment","overflow","source_ref"],"properties":{"layout_id":{"type":"string","minLength":1},"pattern":{"type":"string","minLength":1},"regions":{"type":"array","items":{"type":"string","minLength":1},"minItems":1,"uniqueItems":true},"responsive_order":{"type":"array","items":{"type":"string","minLength":1},"minItems":1},"containment":{"type":"array","items":{"type":"string","minLength":1},"uniqueItems":true},"overflow":{"type":"array","items":{"type":"string","minLength":1},"uniqueItems":true},"source_ref":{"type":"string","minLength":1}}},"theme":{"type":"object","additionalProperties":false,"required":["foundation","layout_profile","theme_profile","optional_effects","source_refs"],"properties":{"foundation":{"type":["string","null"]},"layout_profile":{"type":["string","null"]},"theme_profile":{"type":["string","null"]},"optional_effects":{"type":"array","items":{"type":"string","minLength":1},"uniqueItems":true},"source_refs":{"type":"array","items":{"type":"string","minLength":1},"uniqueItems":true}}},"asset":{"type":"object","additionalProperties":false,"required":["asset_id","asset_type","semantic_role","source_identity","provenance_status","license_or_source_status","source_ref","substitution_policy"],"properties":{"asset_id":{"type":"string","minLength":1},"asset_type":{"enum":["FONT","ICON","IMAGE","LOGO","ILLUSTRATION"]},"semantic_role":{"type":"string","minLength":1},"source_identity":{"type":"string","minLength":1},"provenance_status":{"$ref":"#/$defs/confidence"},"license_or_source_status":{"enum":["CONFIRMED","REVIEW_REQUIRED","NOT_APPLICABLE","UNRESOLVED"]},"source_ref":{"type":"string","minLength":1},"substitution_policy":{"enum":["EXACT_REQUIRED","PROJECT_MATCH_ALLOWED","APPROVAL_REQUIRED","NO_SUBSTITUTION"]}}},"fidelityItem":{"type":"object","additionalProperties":false,"required":["subject_ref","disposition","source_ref"],"properties":{"subject_ref":{"type":"string","minLength":1},"disposition":{"enum":["PRESERVED","INTENTIONALLY_ADAPTED","UNRESOLVED","DIVERGENT"]},"source_ref":{"type":"string","minLength":1},"reason":{"type":"string","minLength":1},"approval_ref":{"type":"string","minLength":1}},"allOf":[{"if":{"properties":{"disposition":{"enum":["INTENTIONALLY_ADAPTED","UNRESOLVED","DIVERGENT"]}},"required":["disposition"]},"then":{"required":["reason"]}},{"if":{"properties":{"disposition":{"const":"INTENTIONALLY_ADAPTED"}},"required":["disposition"]},"then":{"required":["approval_ref"]}}]},"fidelity":{"type":"object","additionalProperties":false,"required":["items"],"properties":{"items":{"type":"array","items":{"$ref":"#/$defs/fidelityItem"}}}},"validation":{"type":"object","additionalProperties":false,"required":["status","implementation_revision","viewport_matrix","theme_matrix","state_matrix","rendered_evidence","accessibility_evidence","comparison_result","reference_identity"],"properties":{"status":{"enum":["PRE_IMPLEMENTATION","IMPLEMENTATION_BOUND","VALIDATED","BLOCKED"]},"implementation_revision":{"type":["string","null"]},"viewport_matrix":{"type":"array","items":{"type":"string","minLength":1},"uniqueItems":true},"theme_matrix":{"type":"array","items":{"type":"string","minLength":1},"uniqueItems":true},"state_matrix":{"type":"array","items":{"type":"string","minLength":1},"uniqueItems":true},"rendered_evidence":{"type":"array","items":{"type":"string","minLength":1},"uniqueItems":true},"accessibility_evidence":{"type":"array","items":{"type":"string","minLength":1},"uniqueItems":true},"comparison_result":{"enum":["NOT_RUN","PASS","FAIL","INCONCLUSIVE"]},"reference_identity":{"type":"string","minLength":1}}},"authority":{"type":"object","additionalProperties":false,"required":["contract_grants_implementation_authority","external_tools_grant_authority","validation_grants_authority","dependency_adoption_authorized","figma_mutation_authorized"],"properties":{"contract_grants_implementation_authority":{"const":false},"external_tools_grant_authority":{"const":false},"validation_grants_authority":{"const":false},"dependency_adoption_authorized":{"type":"boolean"},"figma_mutation_authorized":{"type":"boolean"}}}}}
