{"schema_version":"orchestra.ui-design-contract.v1","contract_id":"uix1-example-dashboard","source":{"provider":"FIGMA","artifact_identity":"example-design-file","reference_identity":"figma:example-design-file:node-1","node_or_component_identity":"1:1","reference_revision_or_timestamp":"2026-08-24T00:00:00Z","evidence_confidence":"CONFIRMED","evidence_refs":["figma:example-design-file:node-1"],"capabilities":["STRUCTURED_CONTEXT","DESIGN_TOKENS","EXACT_ASSETS"]},"design_system":{"primitive_tokens":[{"name":"color.surface.base","value":"#101114","source_ref":"figma:variables:surface-base","evidence_confidence":"CONFIRMED"}],"semantic_tokens":[{"name":"color.action.primary","value":"var(--color-brand-500)","source_ref":"figma:variables:action-primary","evidence_confidence":"CONFIRMED"}],"component_tokens":[],"typography_roles":[{"name":"body","value":"Inter 400 16/24","source_ref":"figma:text-style:body","evidence_confidence":"CONFIRMED"}],"spacing_scale":[{"name":"space.4","value":"16px","source_ref":"figma:variables:space-4","evidence_confidence":"CONFIRMED"}],"radii":[],"borders":[],"shadows":[],"motion":[],"breakpoints":[]},"components":[{"component_id":"button.primary","source_mapping":{"value":"Primary Button","confidence":"CONFIRMED","source_ref":"figma:component:button-primary"},"variants":["default","destructive"],"states":["default","hover","focus","disabled"],"slots":["label","leading_icon"],"accessibility_contract":{"semantics":["native button semantics"],"keyboard":["Enter and Space activate"],"focus":["visible focus indicator"],"names_descriptions":["accessible name from label"],"contrast":["project contrast requirement"],"target_size":["project target-size requirement"],"reduced_motion":[],"error_state":[]},"project_component_mapping":{"mapping_kind":"EXACT","target":"src/components/Button","source_ref":"project:src/components/Button"}}],"layouts":[{"layout_id":"dashboard.main","pattern":"bento_grid","regions":["navigation","summary","content"],"responsive_order":["navigation","summary","content"],"containment":["content remains within viewport"],"overflow":["data regions may scroll internally"],"source_ref":"figma:frame:dashboard-main"}],"theme":{"foundation":"minimalist","layout_profile":"bento_grid","theme_profile":"dark_cyberpunk","optional_effects":["aurora"],"source_refs":["figma:styles:theme"]},"assets":[{"asset_id":"icon.search","asset_type":"ICON","semantic_role":"search action","source_identity":"figma:asset:search-icon","provenance_status":"CONFIRMED","license_or_source_status":"CONFIRMED","source_ref":"figma:asset:search-icon","substitution_policy":"EXACT_REQUIRED"}],"accessibility":{"semantics":["landmarks and controls use project-native semantics"],"keyboard":["all actions keyboard operable"],"focus":["focus order follows task order"],"names_descriptions":["interactive elements have accessible names"],"contrast":["accepted contrast requirements remain invariant across themes"],"target_size":["accepted target-size requirements remain invariant across themes"],"reduced_motion":["motion has a reduced-motion path"],"error_state":["errors are programmatically associated and visible"]},"fidelity":{"items":[{"subject_ref":"component:button.primary","disposition":"PRESERVED","source_ref":"figma:component:button-primary"}]},"validation":{"status":"PRE_IMPLEMENTATION","implementation_revision":null,"viewport_matrix":[],"theme_matrix":[],"state_matrix":[],"rendered_evidence":[],"accessibility_evidence":[],"comparison_result":"NOT_RUN","reference_identity":"figma:example-design-file:node-1"},"authority":{"contract_grants_implementation_authority":false,"external_tools_grant_authority":false,"validation_grants_authority":false,"dependency_adoption_authorized":false,"figma_mutation_authorized":false}}
